{
  "free": {
    "n": [
      2,
      3,
      4
    ],
    "b": [
      50.0,
      65.0,
      80.0,
      100.0
    ],
    "alpha": [
      60.0,
      70.0,
      75.0,
      80.0
    ],
    "h": [
      0.5,
      0.6,
      0.8,
      1.0
    ],
    "bar_shape": [
      0,
      1,
      2
    ]
  },
  "fixed": {
    "v": 0.8,
    "v1": 0.7,
    "s": 10.0,
    "bar_shape": 0
  },
  "constraint_keys": [
    "v",
    "v1",
    "B1_B",
    "h1_loss"
  ],
  "constraint_names": [
    "过栅流速 v",
    "渠内流速 v1",
    "B1 < B",
    "水头损失 h1"
  ],
  "constraint_limits": {
    "过栅流速 v": "0.6~1.0",
    "渠内流速 v1": "0.4~0.9",
    "B1 < B": "> 0",
    "水头损失 h1": "<= 0.3"
  },
  "constraint_types": {
    "过栅流速 v": "original",
    "渠内流速 v1": "original",
    "B1 < B": "result",
    "水头损失 h1": "result"
  }
}
