{
  "free": {
    "n": [
      2,
      3,
      4
    ],
    "q_surf": [
      150.0,
      170.0,
      180.0,
      200.0
    ],
    "t": [
      25.0,
      30.0,
      35.0,
      40.0,
      50.0,
      60.0
    ],
    "B_channel": [
      0.6,
      0.8,
      1.0,
      1.2
    ]
  },
  "fixed": {
    "h1": 0.3,
    "X": 30.0,
    "T_clean": 2.0,
    "theta": 55.0,
    "dr": 0.5,
    "B_channel": 0.8,
    "v_channel": 1.0
  },
  "constraint_keys": [
    "Dh2",
    "h2",
    "t",
    "channel_depth",
    "channel_Bh"
  ],
  "constraint_names": [
    "径深比 D/h2",
    "有效水深 h2",
    "停留时间 t",
    "进水渠水深 h渠 ≥ 0.2",
    "进水渠宽深比 B/h"
  ],
  "constraint_limits": {
    "径深比 D/h2": "2.0~2.5",
    "有效水深 h2": "1.0~2.0",
    "停留时间 t": "25~60",
    "进水渠水深 h渠 ≥ 0.2": ">= 0.2",
    "进水渠宽深比 B/h": "1.0~3.0"
  },
  "constraint_types": {
    "径深比 D/h2": "result",
    "有效水深 h2": "result",
    "停留时间 t": "result",
    "进水渠水深 h渠 ≥ 0.2": "result",
    "进水渠宽深比 B/h": "result"
  }
}
