{
  "free": {
    "n": [
      2,
      4,
      6,
      8
    ],
    "v_h": [
      0.2,
      0.22,
      0.25
    ],
    "t_stay": [
      30,
      45,
      60
    ],
    "h_eff": [
      0.5,
      0.8,
      1.0
    ]
  },
  "fixed": {
    "h_super": 0.3,
    "slope": 0.02,
    "hopper_angle": 55,
    "hopper_bottom": 0.4,
    "kappa": 0.03,
    "T_sand": 2,
    "P_sand": 0.6,
    "rho_sand": 1500,
    "q_weir_design": 2.5
  },
  "constraint_keys": [
    "v",
    "H",
    "B",
    "BH",
    "hopper",
    "weir"
  ],
  "constraint_names": [
    "水平流速 0.15~0.30 m/s",
    "有效水深 H ≤ 1.2m",
    "单格宽度 B ≥ 0.6m",
    "宽深比 B/H 1.0~2.0",
    "砂斗容积足够",
    "堰口负荷 ≤ 10 L/(s·m)"
  ],
  "constraint_limits": {
    "水平流速 0.15~0.30 m/s": "0.15~0.30",
    "有效水深 H ≤ 1.2m": "<= 1.2",
    "单格宽度 B ≥ 0.6m": ">= 0.6",
    "宽深比 B/H 1.0~2.0": "1.0~2.0",
    "砂斗容积足够": ">= 0",
    "堰口负荷 ≤ 10 L/(s·m)": "<= 10"
  },
  "constraint_types": {
    "水平流速 0.15~0.30 m/s": "result",
    "有效水深 H ≤ 1.2m": "result",
    "单格宽度 B ≥ 0.6m": "result",
    "宽深比 B/H 1.0~2.0": "result",
    "砂斗容积足够": "result",
    "堰口负荷 ≤ 10 L/(s·m)": "result"
  }
}
