{
  "free": {
    "n": [
      2,
      4,
      6,
      8
    ],
    "Ns": [
      0.05,
      0.08,
      0.1,
      0.12,
      0.15
    ],
    "X_MLSS": [
      2500,
      3000,
      3500,
      4000
    ],
    "theta_c": [
      10,
      15,
      20,
      25
    ],
    "Tc": [
      4,
      6,
      8
    ],
    "lam": [
      0.2,
      0.25,
      0.3,
      0.35
    ],
    "H_max": [
      4.0,
      4.5,
      5.0,
      5.5,
      6.0
    ]
  },
  "fixed": {
    "f": 0.75,
    "Y": 0.6,
    "Kd20": 0.05,
    "theta_t": 1.04,
    "T_design": 12.0,
    "h_super": 0.5,
    "r_selector": 0.15,
    "SVI": 120.0,
    "delta_H_safe": 0.5,
    "a_prime": 0.5,
    "b_prime": 0.12,
    "t_d": 1.0
  },
  "constraint_keys": [
    "LB",
    "BH",
    "lam",
    "safe",
    "theta_c",
    "O2",
    "weir",
    "nitrification"
  ],
  "constraint_names": [
    "长宽比 L/B",
    "宽高比 B/H",
    "充水比一致性 |λ_actual-λ_design|/λ_design < 15%",
    "安全距离 1.5~2.0m",
    "污泥龄校核 θc'",
    "总需氧量 > 0",
    "堰口负荷 q_L 20~30 L/(s·m)",
    "硝化污泥龄校核 θc'≥15d"
  ],
  "constraint_limits": {
    "长宽比 L/B": "4~6",
    "宽高比 B/H": "1~2",
    "充水比一致性 |λ_actual-λ_design|/λ_design < 15%": "< 15%",
    "安全距离 1.5~2.0m": "1.5~2.0",
    "污泥龄校核 θc'": "20~30",
    "总需氧量 > 0": "> 0",
    "堰口负荷 q_L 20~30 L/(s·m)": "20~30",
    "硝化污泥龄校核 θc'≥15d": "15~30"
  },
  "constraint_types": {
    "长宽比 L/B": "result",
    "宽高比 B/H": "result",
    "充水比一致性 |λ_actual-λ_design|/λ_design < 15%": "result",
    "安全距离 1.5~2.0m": "result",
    "污泥龄校核 θc'": "result",
    "总需氧量 > 0": "result",
    "堰口负荷 q_L 20~30 L/(s·m)": "result",
    "硝化污泥龄校核 θc'≥15d": "result"
  }
}
