{
  "free": {
    "n": [
      2,
      3,
      4
    ],
    "t1": [
      30,
      45,
      60
    ],
    "t2": [
      1.0,
      1.5,
      2.0
    ],
    "t3": [
      3.0,
      4.0,
      6.0
    ],
    "h_eff": [
      3.0,
      3.5,
      4.0
    ],
    "G1": [
      600,
      800,
      900,
      1000
    ],
    "G2": [
      200,
      350,
      500
    ],
    "G3": [
      50,
      75,
      100
    ]
  },
  "fixed": {
    "t4": 1.5,
    "G4": 45,
    "h_super": 0.4,
    "D_mag": 1000,
    "rho_mag": 5000,
    "r_loss": 0.04,
    "D_PAC": 80,
    "D_PAM": 2.0,
    "kappa_PAC": 0.4,
    "v_out": 0.8,
    "T_water": 15
  },
  "constraint_keys": [
    "ttotal",
    "gamma",
    "GT1",
    "GT2",
    "GT3",
    "GT4",
    "LB1",
    "LB2",
    "LB3",
    "LB4"
  ],
  "constraint_names": [
    "总停留时间 ≤ 12min",
    "磁种质量比 γ_mag ≥ 0.5",
    "混合区 GT₁ 5e4~1e5",
    "磁种混合区 GT₂ 3e4~5e4",
    "絮凝区 GT₃ 1e4~3e4",
    "熟化区 GT₄ 3e3~1e4",
    "分区1 混合区 L/B 0.8~1.5",
    "分区2 磁种混合区 L_i ≥ 0.3m",
    "分区3 絮凝区 L_i ≥ 0.3m",
    "分区4 熟化区 L_i ≥ 0.3m"
  ],
  "constraint_limits": {
    "总停留时间 ≤ 12min": "<= 12",
    "磁种质量比 γ_mag ≥ 0.5": ">= 0.5",
    "混合区 GT₁ 5e4~1e5": "5e4~1e5",
    "磁种混合区 GT₂ 3e4~5e4": "3e4~5e4",
    "絮凝区 GT₃ 1e4~3e4": "1e4~3e4",
    "熟化区 GT₄ 3e3~1e4": "3e3~1e4",
    "分区1 混合区 L/B 0.8~1.5": "0.8~1.5",
    "分区2 磁种混合区 L_i ≥ 0.3m": ">= 0.3",
    "分区3 絮凝区 L_i ≥ 0.3m": ">= 0.3",
    "分区4 熟化区 L_i ≥ 0.3m": ">= 0.3"
  },
  "constraint_types": {
    "总停留时间 ≤ 12min": "result",
    "磁种质量比 γ_mag ≥ 0.5": "result",
    "混合区 GT₁ 5e4~1e5": "result",
    "磁种混合区 GT₂ 3e4~5e4": "result",
    "絮凝区 GT₃ 1e4~3e4": "result",
    "熟化区 GT₄ 3e3~1e4": "result",
    "分区1 混合区 L/B 0.8~1.5": "result",
    "分区2 磁种混合区 L_i ≥ 0.3m": "result",
    "分区3 絮凝区 L_i ≥ 0.3m": "result",
    "分区4 熟化区 L_i ≥ 0.3m": "result"
  }
}
